<?xml version="1.0" encoding="UTF-8"?> <!DOCTYPE library SYSTEM "newemptyDTD.dtd"> 
<!--
To change this license header, choose License Headers in Project Properties.
To change this template file, choose Tools | Templates
and open the template in the editor.
-->

<!--//<library desc= SYSTEM>-->

<library location="64-tahrer,Giza,EGYPT" description="containe programming books">
    
    <librarian></librarian>
    
    <book title="C++" isbn="b1" author="dr.C">
        
        <preface></preface>
        
        <part title="p1">
            
            <chapter title="introduction">
                <summary></summary>
                <section>
                    <![CDATA[ 
                       this section will talk about ..... 
                    ]]>
                </section>
                <section></section>
            </chapter>
            
            <chapter title="hellow world">
                
                <summary></summary>
                <section>
                    <![CDATA[ 
                       this section will talk about ..... 
                    ]]>
                </section>
                
                <section></section>
            </chapter>
            
        </part>
        
        <part title="p1">
            
            <chapter title="introduction">
                <summary></summary>
                <section>
                    <![CDATA[ 
                       this section will talk about ..... 
                    ]]>
                </section>
                <section></section>
            </chapter>
            
            <chapter title="hellow world">
                <summary></summary>
                <section>
                    <![CDATA[ 
                       this section will talk about ..... 
                    ]]>
                </section>
                
                <section></section>
            </chapter>
            
        </part>
        

        
        
    </book>
    
    <book title="Java" isbn="b2" author="dr.Java">

        <preface></preface>

        <part title="p1">
            
            <chapter title="introduction" >
                <summary></summary>
                <section>
                    <![CDATA[ 
                       this section will talk about ..... 
                    ]]>
                </section>
                <section>asdfasdf</section>
            </chapter>
            
            <chapter title="hellow world">
                <summary></summary>
                <section>
                    <![CDATA[ 
                       this section will talk about ..... 
                       < > & ' "
                    ]]>
                </section>
                
                <section></section>
            </chapter>
            
        </part>
        
        <part title="p1">
            
            <chapter title="introduction">
                <summary></summary>
                <section>
                    <![CDATA[ 
                       this section will talk about ..... 
                    ]]>
                </section>
                <section></section>
            </chapter>
            
            <chapter title="hellow world">
                <summary></summary>
                <section>
                    <![CDATA[ 
                       this section will talk about ..... 
                    ]]>
                </section>
                
                <section></section>
            </chapter>
            
        </part>
                
        
    </book>
  
</library>
